{
  "room_credential": "<new secret room credential>",
  "room_id": "5b0e2c4d-1f3a-4b6c-8d7e-9f0a1b2c3d4e",
  "agent_id": "7d9e1b2c-4a5f-4e6d-8c7b-1a2b3c4d5e6f",
  "expires_at": "2026-09-30T12:00:00.000Z",
  "renewed": true,
  "keep_this": "KEEP THIS: replace your room_credential with this new one now."
}
